{"contractVersion":"graph/v2","requestId":"graph-request-1","graphSessionId":"graph-session-1","agentRunId":"run-1","tenantId":"tenant-1","ownerUserId":"owner-1","bundleHash":"sha256:aaaaaaaaaaaaaaaaaaaaaaaaaaaaaaaaaaaaaaaaaaaaaaaaaaaaaaaaaaaaaaaa","cursor":{"sequence":3,"completedCommandIds":["cmd-1","cmd-2"],"pendingCommandId":null},"limits":{"maxDepth":8,"maxAgents":4,"remainingTokenBudget":2048}}
